[{"timestamp":"2026-07-07 21:32:45.469322","battery_level":100.0,"cpu_utilization":31.620419847,"sensor_drift":0.0129231463,"comms_link":95.2504928503,"temperature":45.0715574721},{"timestamp":"2026-07-07 21:32:46.469322","battery_level":99.8861735699,"cpu_utilization":28.0745885979,"sensor_drift":0.0178967734,"comms_link":95.3464482095,"temperature":45.1621569053},{"timestamp":"2026-07-07 21:32:47.469322","battery_level":99.8647688538,"cpu_utilization":26.6153899985,"sensor_drift":0.0182864274,"comms_link":94.3199752784,"temperature":45.3166102486},{"timestamp":"2026-07-07 21:32:48.469322","battery_level":99.8523029856,"cpu_utilization":33.0583814442,"sensor_drift":0.0159886137,"comms_link":95.2322536972,"temperature":45.3607604104},{"timestamp":"2026-07-07 21:32:49.469322","battery_level":99.5765846625,"cpu_utilization":35.1549976125,"sensor_drift":0.0191935714,"comms_link":95.2930724733,"temperature":44.9244661264}]